{
  "schema_version": 1,
  "policy_id": "GOV-103",
  "policy_revision": "GOV-103-r1",
  "policy_commit": "ff7b47f7bf17f3d820941522b13032445e612773",
  "policy_sha256": "a65edb493b488abc09c1ba74d956c7299b8d16033044fe12abde3948bf827a69",
  "actor_type": "human",
  "accepted_by": "Hiếu",
  "accountable_role": "Repository Lead",
  "decision": "approved",
  "accepted_at_utc": "2026-09-11T09:53:36Z",
  "evidence_commit": "ad8091080fd54ae316113e09b02ab032e77fc1ac",
  "evidence_url": "https://github.com/Little-Boy-s-ArchSync/archsync-core/blob/ad8091080fd54ae316113e09b02ab032e77fc1ac/docs/adr/acceptance-evidence/GOV-103-r1.json",
  "acceptance_record_sha256": "1d6c823187c5502080367dfd2cbbe4a2424003a2136dcc88d24e338f99b87955"
}
